Rating,Helpfullness,Review Title,Reviewer Name,Review Date,Review Text
10,495 out of 992 found this helpful,One of the finest TV series coming from India.,authentic_writer,15 May 2020,"I was hooked to it from the very first episode, the main character is a true representation of the everyday man, flawed yet tenacious. The characters were intricately put together and the pacing was absolutely perfect. This is an absolute gem and it needs to be experienced. Absolutely loved it, cannot wait for Season 2."
10,73 out of 140 found this helpful,Superb acting with superb script and direction make a superb movie,saurabhsharma-63079,17 May 2020,"This movie revolves around a inspector who is solving case and our system which is rotten is real and reel life both. Alhawat ji acting was superb and his Haryanvi accent and style ,look Acting and everything was amazing and worth for praising He totally steal the show the on him only. These types of movie is only showing how such type of actors are brilliant and capable of doing big things and the story also tells that public will not praise And tolerate stupid stories with big actors Theory and in future, your work and story and direction will be everything.
Alhawat ji you were amazing and the one also who was is subordinate and preparing for IPS both were amazing.Loved it"
10,368 out of 785 found this helpful,Fantastic,ansegal,15 May 2020,Spell bound I was and for a change the police seems real and courtyside good..yes as always there that liberal agenda and that voice of how the moslem are mistreated. But that seems to be set agenda of Bollywood. The series is so enthralling that I bing watched it all night 🌙 oh the lead police inspector his an very very well crafter role. Loved it he is the protagonist the series is from his view
10,298 out of 642 found this helpful,One of finest of 2020,aspnishanth-81860,15 May 2020,"When u start watch it...you will binge watch it...
Starts to ask about season 2..
That's the I want to say....🔥🔥🔥"
10,53 out of 102 found this helpful,Rating A+ Not the usual Good versus Evil,ankurchakraborty-83075,19 May 2020,"I'm not much into those series whose seasons or episodes are too long. This one is neither. Well written amazingly executed for a series, this will create a storm on peoples emotions for a lot of reasons. So a lot of people are going to hate this series for this and for other reasons.Best thing about the story is this is not the usual police procedural. Its starts that way about killing a high profile journalist to proving them they are terrorists to getting to conclusion that this was never about the journalist, it was always about the hitman and killing him. And then everything going down the toilet.Jaideep Ahlawat as Inspector Hathiram Chaudhary was so natural. This is his lead role and he was simply superb. He was so flawless and made it look like a simple acting job. His frustrating part which he would sometimes take out on his junior and also apologised to him for being mean. There was a scene where Hathiram kept on kicking one of the suspects who was at first female then turned to be a transgender, as he was taking out his entire life's frustration and anger on one person. He was also shown to be remorseful and apologetic for his behaviour. More he dug into the suspects pasts, it was clear that he wasn't angry or disgusted, he felt pity for them. Though Hathiram's relationship with his wife Renu Chaudhary portrayed by Gul Panag and son wasn't major for the story but it had an impact in defining the character. What i liked most is that his relationship with his father wasn't much explored or it would have deviate form the story.Abhishek Banerjee had 3-4 lines in the entire series. Everyone knows about his acting capabilities shown in Street and Mirzapur. His negative screen presence is extremely gravity defying. Every time he came on i was like, so okay this character is a psychopath, he's going to do something and then he doesn't. Every time he was on screen he left with a cliffhanger, as if you want him to do something. This was Abhishek Banerjee's method acting, doing nothing and watching with dead eyes. There was a specific scene where his character kills three boys with a hammer and he was just sitting there as an animal who just hunted and is tired.I won't say Neeraj Kabi's role as Journalist Sanjeev Mehra was his best. There wasn't much room for improvement or improvisation since its known what Neeraj Kabi is capable of. Even with restrictions he played the role of big time egoistic journalist as best as he could. There are only two moments which had impact on the character. First was when he realised his wife Dolly Mehra portrayed Swastika Mukherjee who had anxiety disorder and was always depending on her husband to calm her down is no longer needed by her since she adopted a stray dog to fill the hole in her life. Second was when Hathiram told him that Sanjeev Mehra was a big guy and he was small but in reality he is just as unimportant as Hathiram and he just looked big. These two were the ego shattering blow to the character.Mairembam Ronaldo Singh as Mary Lyngdoh or Chini and Niharika Lyra Dutt as Sara Matthews was my somewhere in the middle favourite characters. Sara's respect for her hero Sanjeev turned to love to hate since she got to see what he actually is. A big egoistic hypocrite who thinks he owns everything. She ended up resigning after helping Hathiram in his investigation. Chini's biggest character reveal was she wanted money for the operation so that she can marry the person she loved and thats why she was Woking with the criminals.Biggest plus point of the series is not a huge production team was involved. 4 writers, 2 directors, 2 cinematographers and 1 editor. With small teams a huge amount of focus is always on the execution. Story was simply brilliant. A lot of materials were taken from actual events and watching them played out in a drama is just brutal. Social inequalities, sexually abusing children to family disputes to people going to any length to get what they wanted, violence shown in this show especially the one in the school where Tyagi kills 3 students from his school with the hammer and cracks the skull, has never been shown in the Indian entertainment before. I think dogs had a philosophical sense to the show. A yearning to belong or to feel important by others."
10,190 out of 403 found this helpful,Best Hindi Web series on Prime,ishgrewal83,15 May 2020,Outstanding show. Jaideep is too good in lead role as an Inspector. Arguably best hindi web series on Prime or even all platforms. 10/10
9,209 out of 462 found this helpful,Not a sec is a waste of time. Another blast by Drishyam Director,singhprashant0015,15 May 2020,"Amazing direction. Don't think, just go for it !!
A genuine gift in the Lockdown!!!"
1,408 out of 934 found this helpful,Acting is good but story and screenplay is average,rohinibanerjee-50460,15 May 2020,I started with lots of expectations but found it bit slow. Acting wise all actors have done brilliant work especially Jaideep Ahlawat and A banerjee. Story could have better. Neeraj kabi acting was average. One time watch. Dont keep much hopes.
10,131 out of 285 found this helpful,Hard-hitting yet enjoyable.,ashishhoro-49940,15 May 2020,"Paatal Lok has complex and a dark storyline, yet it's like psychological thriller kind of storytelling."
1,302 out of 688 found this helpful,I found it boring.,Taranarana,15 May 2020,No hard feelings but i found this show really boring. It was a short story but it dragged it too far. I hated it. That's it
9,157 out of 347 found this helpful,Amazing...well knitted story!!!,prasanna_iyer,15 May 2020,"Everything is amazing about this series... story, casting, location...wow!!!... just finished it in a day...well knitted..!!! Worth binge watch!!!"
1,295 out of 675 found this helpful,Truly a waste of time,kamathrajath,20 May 2020,"I was having high hopes on this show. But it's not as good as most people are claiming it to be. I wish there was a negative rating, this show is worth your time."
10,101 out of 219 found this helpful,Sets A Bench Marks.,alokranjan-34952,15 May 2020,"If a category like ""perfect"" in the Indian web series categories exists, then ""Patal Lok"" must be top in the list.The whole series was like a journey. In which the character Inspector Hathiram Chaudhary was a co-passenger the viewers like me.The series seems to satisfy every type of audience, giving a happy ending with unexpected climaxes.This series has become so good that the writer of this series will continue to have a lot of pressure over the director, producer and all the other participants to bring its counterpart to the next season.This series has set a benchmark.The responsibility has fully played, given to Jaideep Ahlawat.Best wishes to Cast and Crew."
8,143 out of 320 found this helpful,Amazon never disappoints.,djdevansh95,15 May 2020,"Patal Lok , is a new crime drama series. It is produced by Clean Slate Films (Anushka Sharma's production house which is also responsible for Pari & NH10). The creatives heads behind the show are also noteworthy, like Sudip Sharma(Udta Punjab), Navdip Singh(NH10 & Laal Kaptan), Hardik Mehta(Kamyaab), Prosit Roy(Pari). If one does'nt really now about anything about the show, the creative heads are enough to feel hyped.
So the first few words about the show is that, the hype is real real. They delivered something worth your time. The show is about for criminals who are trying to attempt a murder of the most respectable news journalist. Due to anonymously typed by someone they get caught. Somehow the case is thrown by the higher authorities to the the local thana officer (Jaideep Ahlawat). He is so a desperate person for his promotions. Jaideep Ahlawat as a cop delivered his best role. He is so natural, raw, vulnerable, kind, and a person who knows and accept his limits.
The show is a slow and steady burn. It will defiantly take time to sync. That's why it has to have a solid pay off in the end. Man it is worth every second of your time. Go watch it asap!"
10,48 out of 98 found this helpful,Best series to watch during Lockdown,kakauppal,19 May 2020,This is the best series I watched during the lockdown. I had to finish it in one go. Highly recommended!
9,135 out of 302 found this helpful,A Masterpiece..!! Worth in lockdown 🍻,deveshtanwar,15 May 2020,"Must watch for the action, suspense and thriller lover's.
-Excellent work by Sudip sharma and Jaideep is fantastic as always even new talent Abhishek banerjee fits in the character of Hathoda tyagi.
-Action scene are as realistic as we scene in Mirzapur, even it gave similar essence of uttar Pradesh touch.
-Just waiting for season 2."
10,181 out of 414 found this helpful,You can't miss this,kfulshankar,15 May 2020,"I bet this web series will make your lockdown good, strong script, good acting"
2,155 out of 356 found this helpful,A promising start which fizzles out midway,mayurp-51570,15 May 2020,I was hooked on this show from the first episode and it keeps getting better till 4th episode. After that it's just dragging the plot till the last episode. It should have been shorter in length.
10,149 out of 342 found this helpful,Best,hrithikrai-77532,15 May 2020,"Best series of 2020 ,awesome star cast and outstanding performance by jaideep ahlawat(hathiram chaudhary)"
9,138 out of 318 found this helpful,Great Storyline,ayndta,15 May 2020,The storyline is great but the speed of the show is not so fast... But dont worry bcuz the show does not looses its grip and the cliffhangers are fantastic.You can easily complete this series in one sitting.
8,130 out of 301 found this helpful,Performances makes the Well Written Story more Entertaining. - itsbymayank Review Paatal Lok.,mayanklouteriya,15 May 2020,"One word Review - Raw.
Very well written and directed, Every character has done his job in the best way, the story get distracted just because of unnecessary things but not every time. Slow start but makes it engaging with time, Bit lengthy but ok. Described every character's part/story and it is somewhere necessary to do, that brief thing make story engaging somewhere yes.
The Performance of the lead Jaydeep/Ishwak Singh n Neeraj Kabi and all character's work is flawless, just that they enjoyed and lived the story. The story doesn't revolves around the criminal and crime everytime it has more to show.. Watch Abhishek Banerjee he is gem.
Story is good, Gripping, Real. Worth Watch.
-itsbymayank Review of Paatal lok.
""Mayank Bharat Bhushan Louteriya"""
1,160 out of 377 found this helpful,Worst we series,vckmishra7,17 May 2020,Trying to copy english webseries while having story without any entertainment factor
10,123 out of 285 found this helpful,"Cult crime drama never expected,it's just a surprise pack",shivaji-09630,15 May 2020,"Paatal lok just surprises you that reaches more then your expectations, hathi ram charecter it's just a bone for the entire series ,keen solving and engaging the audience with some awesome screen play and story , this is more then I expected must watch and you will never regret after watching,go for it."
1,145 out of 340 found this helpful,Worst webseries pathetic storyline,pabhishekap,20 May 2020,"The worst webseries ever I see in my life although the acting of cast is good but the story is too slow paced. It doesn't excite you to watch next episode and pathetic storyline, it doesn't conclude the story in my opinion ending could have been better."
9,101 out of 235 found this helpful,An Adrenaline rush till the end!,shivapraneeth,15 May 2020,"Beyond belief, firstly would like to congratulate the cast and the crew for producing this amazing show. This show again proved that neither the actors, directors, producers nor technicalities like graphics and visuals but it showed us that content(Story) is the king. When you get a good story and a story teller visions right then it is a magic on the screen and proud to tell you guys that i had this magical experience while watching this show. Finally thanks to Amazon Prime man you guys nailed it again on of the Best shows of the year."
10,34 out of 71 found this helpful,A must watch investigative thriller,pintuvig,17 May 2020,A very well written script and screenplay. All elements in appropriate amounts. The actors transformed the director's vision more than what was expected. Kudos to clean slate and Anushka for producing and identifying worthy scripts.
1,119 out of 283 found this helpful,You're better off for not watching it,anchitpandey,17 May 2020,"Bad script, child abuse in the name of creative acting and direction show. Degrading show in general."
1,114 out of 272 found this helpful,Not good,rahulkus-50739,16 May 2020,Not good. Acting is good but not storyline. Story is predictable from first episode.Few actors performed well but because of week storyline the series is not able to hold the interest.
3,46 out of 101 found this helpful,Ending is disappointing,amitmworld,16 May 2020,"I have seen complete series, few points i have observed
3 star for acting by main charactersDirector looks biased to show one community innocent, it has been shown in series many times. Which make the story telling very awkward. This looks like we are watching NDTV. I feel series should not take any political stand very clearly. It can have vantage point what one person think. We are not here to see what a director/ writer thinks.Ending is very awkward, like some good suspense ending , come-on we are not watching hindi movie ""Teri Meharbaniya""This is my personal view."
1,117 out of 280 found this helpful,Utter crap,rish2006,21 May 2020,Just watch anything on prime except this 'paatal lok'. Another stupid psycho killer type lame story.
1,88 out of 206 found this helpful,"Worst n useless, waste of ur time.",indiabharat-72827,17 May 2020,"Very common to show in series or bollywood movies against hindus, downgrading hindu gods etc n glorifying muslims. Hate it."
9,92 out of 217 found this helpful,As raw it can get,nairanupgk,16 May 2020,"A breath of fresh new writing which reprsents the blood thirsty politics of rural india. The last i remeber any movie which came close to addresing this issue was hassil, after that definitely it is pataal lok. Enjoyed it....."
9,97 out of 230 found this helpful,Easily placed in indian webseries all time best.,kanti_banerjee,16 May 2020,"This country needs more such content. More such thoughts.
Loved the way it subtly potryas the recent indian socio political scenario.
Overwhelmed with the vintage sarcasm & dark comedy. I always heard good comedy can come out of very serious situations too, perfect example of that.Thrilled with the vividity of the charecters.
First three or four episodes was building the backdrop and suddenly it bowls you over with its brilliance.
I repeat this country needs more such contents and thoughts"
1,51 out of 115 found this helpful,Worst story,saur-90316,20 May 2020,"There wasn't any outcome in the story. Inspector has a dream to prove himself of any worth in the eyes of his family which was only achieved because he got his son's friend which has nothing to do with the main story which doesn't end in any way and the Inspector didn't achieve anything because of it. At last you will feel why was even the motive of the story, where did it really tried to go."
2,60 out of 139 found this helpful,Propaganda,palknpcst,20 May 2020,"This show is utterly Hinduphobic in its Content.
Propagating Leftist-Commy agenda in a subtle way."
10,91 out of 221 found this helpful,This is Baap of sacred games and mirzapur,dextersiddhu,15 May 2020,This show is baap of sacred games and mirzapur. Jaideep is a gem. All actors did good job.. Such a great and well made show. Not a single second felt bored. Must watch show.
1,51 out of 119 found this helpful,Ordinary story,agamit-68738,20 May 2020,Nothing special in the series. The plot seems like you have seen it at many places before.
10,70 out of 169 found this helpful,Must Watch!!!,taylorbernathal,15 May 2020,"Paatal Lok isn't a mere crime thriller. It's a visceral, haunting narrative that digs deeply into the ugly trappings of a depraved system that dictates and determines lives."
1,45 out of 104 found this helpful,Hinduphobic content,rohit-04463,17 May 2020,"Well it's high time that Indian Series realise that they need to stop showing Hinduphobic content..,,
It's a shame that you guys time n again keep downsizing Hindus..."
10,24 out of 51 found this helpful,Super Super super,tumsakoinahi,18 May 2020,Its very Mind blowing To watch.. Its really worth To watch it .. Amazing script
1,45 out of 105 found this helpful,Script written in a hurry!,neetabora,17 May 2020,"Many loop holes. I don't understand why policemen were running to Chitrakoot or Punjab without even interrogating the criminals properly.
Communication is missing in many places, assumptions are made.
Just coz the story writer knew they were connected to Chitrakoot, the police went there, even though they had the criminals in their hand. And they're running themselves, they could've either contacted local Chitrakoot police for info or sent any junior officer. They're listening to criminal's background stories like Panchtantras while not spending enough time to interrogate them in lockup.
It's very slow many times! No good dialogues too. I feel sorry for Gul Panag the most.
Also, it's very painful that series are extremely left leaning nowadays. I expect series to bring out good & bad in all communities as there are good & bad people in every religion. Why do we always have to run a propaganda? It's like listening to a friend after his/her divorce. They'll always tell how good they are but ex wife/ husband is bad etc.
The non veg in train scene - very kiddish. I've travelled with people from muslim, non muslim communities & they never bring non veg in train. It's not about religion but food habits. Fellow passengers might get uncomfortable or meat get spoilt. Even my family is non veg, but we never carry it in train.
This shows the script wasn't given much thought. Very immature & unrealistic approach.Although I liked their acts but giving less rating since it doesn't deserve 8."
1,59 out of 142 found this helpful,Give respect to women,rizeonsk,18 May 2020,"Episode 2, 3:41 minutes
There is a sentence "" you lying Nepali whore "". That's not fair to insult other countries citizens this wa. This content must be removed.....!!!"
1,40 out of 93 found this helpful,Wrong story line intended to spoil the reputation of indian police and Indian governance,advakss,19 May 2020,"The entire season is entertaining however the story revolves around discriminatory view against once society with intention to create a roumors of bad governance in India and diplicts poor and wrong approach of Indian police system, assassinating their characters and approach which i think is noting is bad moral of entire story therefore i dont like that...."
1,22 out of 47 found this helpful,Too slow web series,rohitrajjnv,20 May 2020,"Story is too slow and it will take 6.5 hrs to finish it..it should be finished in 4-5 hrs.
You can't compare it with sacred games, Asur and family fan.."
1,37 out of 86 found this helpful,Utter boring,ramborocksever,23 May 2020,Not talking about the core point of the film. But this is dead boring and slow like a snail. Deviates all the time from the point and comes with total crap. I regret now and should have invested my time on something else.
10,65 out of 162 found this helpful,Gripping from start to end. Simply wow.,rajdeepcal,15 May 2020,What a story telling. Brilliant acting which doesn't look like one. Crisp script and shooting locales and cinematography superb. But the background score is hauntingly brilliant and it stays with you after the series is over. Can't wait for the sequel. And the punjabi rap (though I don't understand punjabi) was wow. All in all. Sixer hai boss.
2,24 out of 53 found this helpful,End Will Break all our Expectations,moreswapnil-80182,24 May 2020,I will rate this series on basis of a content. The writer has introduced mythological character A Dog and Hiranyakashyup . He wish to relate few characters to them and this is where the trouble arises. The director couldnt do justice to specify this plot.Minority situation has been shown from one point of view which has been done from past. They are suppressed. A more hard hitting end would have made me give 8/10.
10,24 out of 53 found this helpful,Peerless,skchandel,19 May 2020,In Hindi or Indian cinema this type of content we rarely see . Recommend this webseries strongly.
10,24 out of 53 found this helpful,Simply Awesome,tejasnaik-00095,19 May 2020,"A web series which outstandingly portrays all the possible layers of today's society, the casteism which is still prevalent in some parts of India, how people will ruin so many lives for their own personal gains, and how fake news and stories can be so dangerous. There is no Hinduphobia in it. It is the bitter truth and we need to swallow it. The world is not all merry merry. We must embrace both the good and the bad."
3,22 out of 48 found this helpful,"Apart from Hype, this show has nothing.",unrivaledraj,22 May 2020,"This show is really bad, I mean like literally terrible. And it isn't because of a religious angle or Hinduphobia, because there's no such thing in the show. Apart from a few scenes that shows a muslim being a mob lynched or has to hear some racial slurs in his workplace which is very true, this show doesn't even attempt to create any kind of religious angle, the bad reviews here based on such things are just ardently stupid and themselves view everything through a religious glass.
This show is bad in terms of story, acting, screenplay, music and direction. You have actors like Neeraj Kabi, Rajesh Sharma and the director and writer had no clue as to how to utilise them on screen. The series span to 9 episodes, which is just a waste of time and could have wrapped this up in 4-5 episodes. So many sub plots are created and have absolutely NO relevance to the main arc, like-
1. Hathiram's son and the scenes of his gun or school, or his class etc have no relation to the story, and doesn't impact Hathiram in anyway. Waste of time.
2. Sanjeev Mehra's wife(Swastika) and her anxiety, I don't know why did they put it on the show, makes no sense to the story, her love for dogs was enough relevance, a good amount of time is wasted on her anxiety which is utter stupidity in terms of relevance to the story.
3. Hathiram's brother in law and his wife scenes, has nothing to do with main plot.
4. The four accused in the attempted murder, apart from Vishal Tyagi's character backstory, none of the other 3 stories matter or has any kind of impact on the main plot and so much time is spent in explaining their character backstory and it doesn't even impact the main plot, like replace these 3 with any other tom, dick and harry and the main plot won't change even a bit. Such is the irrelevance.
This shows biggest problem is the story, there's nothing for the actors to act upon. They tried a bit of Sacred Games here, trying to establish all the characters and portraying their backstories spanning decades, but where they fail is that every Sacred Games characters backstory is directly/indirectly related to the main plot, while in Paatal lok it's all haywire. It would have been much better if they had turned this into a mini stories and put in some better roles for the cast to portray. This series is way below average. And I'd like to say again, there's no religious angle to main plot. People themselves are racist to view it in such angle."
