Rating,Helpfullness,Review Title,Reviewer Name,Review Date,Review Text
10,16 out of 36 found this helpful,Best of 2020,mdsohrab-76024,15 May 2020,All time blockbuster webseries. Complete in one sitting and trust me i never thought about skip some second of any parts .
10,13 out of 28 found this helpful,Great,ahujarani-52899,18 May 2020,Acting & Dialogues are good. Anushka doing a great job
10,13 out of 28 found this helpful,best web series in recent times,marshallndj,18 May 2020,Wow so much thrill an amazing web series not to be missed. Amazon prime does it again by giving a amazing show to watch kudos.
10,13 out of 28 found this helpful,Must Watch WebSeries,ImKaatil,17 May 2020,Don't go for bad reviews which contains hindu muslim word. I think and must say the best webseries till now in Indian Industry & whole team worked hard to brought this masterpiece to Indian community because it's not made to spread hate. It's all about truth and and how good and bad peoples are in reality. Must watch for those who liked sacred games bcoz it's far better then sacred games & at last i very rarely give reviews
9,13 out of 28 found this helpful,Shabitri...,matrixdukenukem,16 May 2020,"Short review: Paatal Lok is what you get when film makers and writers don't have their hands tied by censorship board. This is the answer to those who ask why doesn't India have Scorsese or Tarantino.Okay yes this is not any Tarantino level stuff but we are getting there. No one can deny this isn't a step in that direction. Prime is working fast and hard to give us content that till now only Netflix used to possess. In the OTT wars we are the winners. All 9 episodes are worth your time. Jaideep Alhawat is terrific and on top of every scene. Gul Panag and Neeraj Kabi work hand in hand with Jaideep. Special mention to child actors. India really has started to cast proper junior actors recently.There are many messages to take, many discussions to have. This show doesn't pull any punches to show stark reality. Backstories of every character is brutally explored and some will punch you in the gut.I hope there is a season 2 and we see more of these fine actors.P. S. It gives me joy to see reviews from those who need immediate supply of burnol."
9,13 out of 28 found this helpful,Ek dum Taad Faad,anujbawa-67072,16 May 2020,"This is a Superbbb webseries. They have described rawness of its characters. Everybody have done a Superbbb acting. But i like most Hathoda Tyagi , Neeraj Kabi, Jaideep Ahlawt and offcourse four guys who accused of this trap.Hathoda Tyagi have played a Mindblowing character. But one thing disappointed me its end😢. Overall its a Mindblowing series you will definitely lost in Patal Lok.👍👍👍"
9,13 out of 28 found this helpful,Spectacular,gauravtomarec,16 May 2020,"Good to see mature stories coming from Bollywood, I was not about to find any flaw in the series."
10,13 out of 28 found this helpful,After longtime,bua-raha,16 May 2020,"No unnecessary sleazy scenes, top of the acting, controllers violence scene as needed and a potboiler thriller..not targeting any community or religion or politics party unlike some of the overhyped high starrer web seriess in India...liked it..cause of acting and suberb direction and the underlying message delivery style...nice work"
10,13 out of 28 found this helpful,Wow,dineshdhiman,16 May 2020,"No one was hero here but every one performed thier best.
10/10 for story"
10,13 out of 28 found this helpful,One can say that u r lockdown is awesome if you are watching paagal lok,yuviraj-98217,16 May 2020,It's hold you till end One can say that u r lockdown is awesome if you are watching
10,13 out of 28 found this helpful,Smashing acting by Jaideep Ahlawat and hole team,kdhruv,15 May 2020,"Haryanvi dialogues delivery was so perfect.
This series is just a mirror to our system, politics and our religious mentality.how our bad system changes everyone life."
9,13 out of 28 found this helpful,Perfectly Written,masterrgogo,15 May 2020,"They have done an excellent work portraying the characters,, steady thriller and keeps you wonder,, great job.. netflix should watch these indian series,,"
9,13 out of 28 found this helpful,grisly rustic and brilliant,parikzit,15 May 2020,"Jaideep Ahlawat ! you rock..
A gritty thriller that keeps you hooked until the very end. And its not whodunnit ..its just the direction, the character development and superb acting. The relationships are beautifully developed ... superiors, colleagues, sons and spouses .The juxtaposition of urban and rural was very well handled..
Some of ""left liberal saale"" and eternal victim effect does come in fray which could have been avoided as it was unnecessary to story line, but what the heck.. its directors baby :) ..he is allowed his FOE !"
9,13 out of 28 found this helpful,BEST THING YOU'D WATCH TODAY,ashishrajbhatia,15 May 2020,"The writing, editing, acting and direction are soooooo good . It's like the dish, that you savior so much , that you want suck the last drop out of it..
Best part is , it doesnt spoon feed you information . So you have to be all attentive and cant miss out even a single moment"
8,20 out of 47 found this helpful,Full of suspance,Death-Shivam,16 May 2020,6 hour 30m and 33sec will pass so easily like you couldn't be able to imagine how fast the time goes. Each episode is full of thriller and suspance. Loved it 💟
9,20 out of 47 found this helpful,One of the best Indian TV series.,daspratyush-06502,16 May 2020,"Gripping hold to strory. The thriller, the twist, the story got me stuck to my seat. I hesitated even missing a single scene. The casting was brilliant. It brought out the true flavour of India, showing the colours of media, politics, police. It sets a bench mark up so high for competition. And this is great news for viewers that they are seeing such content."
10,20 out of 47 found this helpful,Absolutely brilliant,pushpendrameena-89339,16 May 2020,"Sets new standard of web series
Really must watch
Contain Based ,dailogues u will remember after weeks"
8,20 out of 47 found this helpful,"Brilliant plot & acting , need to rake with pinch of salt though.",gangesh194,16 May 2020,"Jaideep Ahlawat.
What a performance. paatal lok is one of the best series.
Main plot is great all actors have done great job.
Other than hathi , ansari ,DCP, mehra's characters are layered and well written.Just need to ignore some cringe,cliche,surface level, one sided , ""feminism"" ""sickulirism"" ""equality"" sub plots."
10,20 out of 47 found this helpful,A MUST WATCH.A GEM OF INDIAN WEB SERIES,nageshbalusani,16 May 2020,"Normally i never write reviews. But after watching this series it compelled me to write.
What a series!!!!!!. A big round of applause for the writing department and the direction team.Hands down till now this is the best Indian web series i have watched, leave Indian till now the best story line i have ever seen. a thrilling and pulse grappling story. the way the director took the story with the twists and turns. kudos to the whole team.M eagerly waiting for more films or series from these directors."
10,21 out of 50 found this helpful,Fantastic,kulshiva,17 May 2020,"Awesome Web series. A must watch.A wonderful combination of Thriller , Suspense & Action."
10,21 out of 50 found this helpful,A Masterpiece which will move you inside out!,sukhish-puri,17 May 2020,"Like many others... I have been watching Netflix, prime, HBO, Hulu, etc since the inception and after so much of fine television & cinema work, we think that we have seen it all.... And then comes Paatal Lok.
It's one of the darkest and disturbing TV show and sometimes it becomes difficult to watch but then you look beyond and see how difficult it must have been to film it. I could never imagine a Indian TV series could be so brilliant, so amazing that whatever I have seen in the past looks weak and to an extent... Lame!
This is the best Indian TV series by a long shot and one of the best in the world... If not the best!
The research work done on this is just ridiculous, things which have been shown in this can't be imagined if someone hasn't gone through them. The direction, the acting, the cinematography... Everything is top notch and the very best! The bar they have now set for Indian television would be difficult to beat.
Hat's off to pull off something so incredible, so real that it will go down as one of the best every made. Truly a Masterpiece!"
10,21 out of 50 found this helpful,Haathi Ram.. you nailed it!!,sachingupta-30918,16 May 2020,"There are so many movies and series where they play a Haryanavi guy. In most of those, I ended up complaining about their accent. They try hard to sound Haryanavi.But this guy, Haathi Ram (Jaideep), was just perfect. Dialog delivery was flawless. It felt as if I was surrounded by old friends from my hometown (Rohtak). He did justice to the character. Some may say it is too abusive. But, that's how people are back home. But at heart he is always a nice guy and tried to the right thing like most people in this lovely state, Haryana.Story itself is very good. A nice plot telling how the most horrifying criminals are made by community.Well done! A must watch!"
10,21 out of 50 found this helpful,"Cops, Politics, Media, Relationships and a hard-hit reality",bdb-4617,15 May 2020,"One of its one kind. original, mind blowing and Darkest-thriller is a binge worthy watch. Released during lockdown and one cannot expect a better mixture of thrill, violence, 'family and friends Thing' and a disturbed past. The originality of characters and their acting takes it to the new level. If you are fan of original content with mix of real life scenarios, then tick it off your bucket list as soon as possible."
9,17 out of 39 found this helpful,Has its finger firmly on the pulse of the nation,mubariz-shariff,16 May 2020,"Great series. Well directed. Superbly cast. A very realistic screenplay and story about corruption, greed and lust for power at every level of society.Anushka Sharma is a very intelligent producer. She has backed a solid project.All the high ratings are very well deserved. Keeps you engaged from start to finish.Ignore all the poor ratings and reviews. I read most of them and they all seem to be written by the same person or at least the same kind of people. The language used in those reviews says it all. They're all part of the ""Hindu Khatre Mein Hai' crowd who have graduated from Amit Malviya's WhatsApp University.The acting by Jaideep Ahlavat, Niraj Kabi, Niharika Lyra Dutt, Ishwak Singh and Abhishek Banerjee is deserving of critical acclaim.Great Series. A worthy binge-watch."
10,17 out of 39 found this helpful,Direction looks realistic,bhaskarrajn,16 May 2020,Best background of all character described deeply shows the quality of direction
10,17 out of 39 found this helpful,Brilliant !,vinayak-32201,16 May 2020,"Just Brilliant ! This is the best Indian thriller till date by a mile. Binge watched it. Kudos to the director in perfectly knitting the little knots of this story. If there is something that can keep you glued till the season finale, this has to be one among them. I would not like to reveal any spoilers, but if there's something that should definitely have a next season , then this is it."
10,17 out of 39 found this helpful,Riveting storytelling,Teasaurus,15 May 2020,"You know it's a brilliant show just from the sheer number of whining victimized reviewers here. Watch it twice just for the trolls, give them something to really cry about."
9,17 out of 39 found this helpful,"Powerful, Realistic, Great Performance",dhrooovs,15 May 2020,"Better than Mirzapur .
Leaps and bounds above Sacred Games.
I won't even count Family Man."
10,11 out of 23 found this helpful,Best web series in India,rudraquizzer,19 May 2020,"Brilliant story line and screenplay for those who can read between the lines , awesome acting specialy from Mr ahlawat and others , superb direction although you can expect such outcome when Director's name is avisnash arun. If you think twice story is simple yet so many things to say. This story covers all the aspects of the society also reveals the mystry and true face of our society as well. Intelligent direction, superb acting also little bit research on human psychology and tension between the characters in each screen make the simple story more intense. Must watch for all atleast if we want our Indian audience to literate enough to understand such works in future , I guess this is just the begining of new era in ott platform with such etched upon your memory presentation."
10,11 out of 23 found this helpful,loved it,nehachopra-69277,18 May 2020,"I'm completely in love with this tv show.With the suspense and twists through the series, all the characters are unique and you have love for them all in a different way."
10,11 out of 23 found this helpful,This is one of the best shows i have ever seen,neemagupta-37480,18 May 2020,This is one of the best shows i have ever seen . it has so much thriller . i never felt bored for a moment
10,11 out of 23 found this helpful,"Love it so much,",nandinisuri-26082,18 May 2020,"Love it so much, and I am a very critical person when it comes to tv shows. But I definitely liked everything about this show, plot, music, and most of all the cast ! Amazing one !"
10,11 out of 23 found this helpful,what a concept. ...,mohsink-42889,18 May 2020,"Congratulations to everyone involved in this excellent series.what a acting, what a concept. thanks all of cast"
10,11 out of 23 found this helpful,Great drama,rehank-47094,18 May 2020,"The evils of society if you will the effect of religion convoluted to serve the manifestations of the powerful,"
10,11 out of 23 found this helpful,one the best ever thriller,dollymathur-56138,18 May 2020,This series was one the best ever thriller i have seen in recent time. It's was like an addiction to binge the entire series
10,11 out of 23 found this helpful,What a Masterstroke,vagleankur,18 May 2020,"Topics like these become conversation starters amidst awkward silences at parties we love to see women get thrashed, belittled, treated like objects/possessions/property across multiple instances, we love to portray the injustice"
10,11 out of 23 found this helpful,nice,devyanshimathur-59598,18 May 2020,"Every character is so well etched out!Great dialogues, nice scenery, very good cut scenes and cross story telling."
10,11 out of 23 found this helpful,Great story,bk-76818,18 May 2020,"Great story, directing and fantastic acting. You cannot stop watching!If you like intellectual suspense, this has to be the best show made in a very long time"
9,11 out of 23 found this helpful,Watch for Jaideep Ahlawat,ksr-91822,17 May 2020,What a splendid series and splendid performance by Jaideep Ahlawat. Applause to everyone associated with this series. Easily one of the best web series in Hindi. Dont miss it !!
10,11 out of 23 found this helpful,amazing.,juckie_4,17 May 2020,"Once again Indian series on next level.
awesome story screenplay and actors."
10,11 out of 23 found this helpful,Art of storytelling at its best,aakaash-aki,17 May 2020,"This may not be the best series, but by far has been one of the best story telling in the web series.
The acting by the lead role is just the thing to watch out for. It will be slow, but just let the feeling sink in and it just adds to the watching experience.The series has its low and highs.. But it's all part of the watching experience."
10,11 out of 23 found this helpful,Amazing...,ani_b20,17 May 2020,Wonderful casting... brilliant story telling .... equally brilliant acting... Kudos to the entire team....
10,11 out of 23 found this helpful,Made in India...and made FOR India..must watch!,ankitthedon-sharma,17 May 2020,"My rating says it all ..hence I will come down directly to basics.
Acting: Just fabulous. Jaideep has always been the top notch actor and I don't know how directors used to overlook him. Shout out for Abhishek Banerjee...please directors ..cast him more..and give him all dark characters that you used to have Nawaz Bhai in. He is more authentic killer. Neeraj is like always..flawless yet in a flawed character. Others too played their role very well. Seeing Gul Panag after so long was refreshing..and she did a decent job ..even as a housewife.
Direction : Mind-blowing. This director should be directly admitted to the league of Tigmanshu, Anurag and Mehta. I have no words to describe how well he has directed this.
Story : Heart wrenching... True story of UP MP Punjab and outskirts of Delhi. Bhakts will dislike it because their faces have been exposed at many times. Had a feel that this was about politics but it's not...politics is there just like 'Kadi-patta' in your curry. Those who are sledging it are Tiger Shroff fans and wanted tiger typos in this movie...but this show being 'real'... tiger didn't make a cut.
Thrill/suspense : I have been awake all night and finished just 6 episodes...had to take breaks in between to gulp the suspense. It keeps you on the edge of your seat all the time.Comparison to others : Cannot compare to sacred games..but yeah Jaideep acted far better than our Nawab Saab . Story too is not as convoluted as Sacred Games. However it is far far better and 'real' as compared to Apaharan sort of gimmicks.Must watch for : PataalLok ..if you are interested in ground zero of Indian crime scene. Jaideep Ahlawat, Abhishek Banarjee, Neeraj ..bind you to the screen within first 15 minutes. To understand the problems of Indian villages. The society has been unmasked.Must watch. You won't regret it. And yes Muslims are looked down upon and so are Dalits and women. So dont cringe at reality..change it. I am an upper caste Hindu saying this to all haters( illiterate ppl) out there.
Tc."
9,11 out of 23 found this helpful,"Gripping , surprising , must watch.",akashgarg-48328,16 May 2020,"Kudos to especially the story and then Jaideep Ahlawat for his work , dialogue delivery in haryanvi accent...his acting was superb throughout the series. Abhishek Banerjee work was also amazing though in whole series he got less dialogue but the expressions and body language was top notch.His son's character was also a good one.Then Neeraj Kabi was good, thought the climax was a bit let down as expected more. Series will throughout hold you till the end and never creates a loose end which shows how the good direction is. So must watch and it's amazing.Must remember - That good deeds are always common in every lok."
10,11 out of 23 found this helpful,"Meticulously directed, exquisite screenplay, bravo",csadvrishabhrsharma,16 May 2020,"One of the best and to the point show I have witnessed since a long time , without a doubt it's at par with the best shows of all time. Very intriguing which gives a perfect picture of the present day society. ❤👏👏"
9,11 out of 23 found this helpful,Sensational web series,sudesharya,16 May 2020,Amazing performances and acting of all the artists.
8,11 out of 23 found this helpful,"Not an epic but a good one time watch,a journey into darkness",pranay_misra,16 May 2020,"Pilot of the show was good but after that, show started going downhill until it revived from 6th episode and there on, it was a rollercoaster ride. Kudos to Jaideep ahlawat for brilliant acting. Also special mention for the muslim inspector who won the hearts with his brilliant acting.Plot is bit tricky but sums up well in the end, provides a satisfactory ending.Shooting and setting is good.Though i expected more from abhishek bannerjee, but his role was small though satisfactory. Also i liked his partner in crime, tope singh.Overall, good option to spend your weekend with, and definitely a better ending then The family man."
8,11 out of 23 found this helpful,Great acting effort by cast. Story feels bit slow.,abhipise,16 May 2020,"Story depicts lots of angles of indian society, and leaves audience with a simple message that showing humanity doesn't cost you, and will indeed be a benefit. All the actors have worked really hard in portraying the characters. Especially the lead Jaideep Ahlawat playing cop hathi ram choudhary. Story feels a bit slow and could've been faster. But it's a great experience overall to watch this series."
9,11 out of 23 found this helpful,One mark cut because of propganda,magadalwarmayur,16 May 2020,"It is very engaging serise and yes it is very violent at times.
I had to turn away from phone couple of times"
8,11 out of 23 found this helpful,Good Show !,proabhinav,15 May 2020,"It is absolutely correct to say that this is an answer to Netflix' Sacred Games.I think the only difference, if we end up seeing after months b/w this show and SG would be because big names in Netflix may end up making us biased towards that show.Patal Lok with no big names but with a good story till the end will keep you hooked up. I must say imho that the credit should go to direction and that makes the a complex story easy to follow , still intriguing and one to follow till you close.I binged watched - 9 hrs !"
10,11 out of 23 found this helpful,Must watch,rutiknpawar,15 May 2020,Great writing. Acting is awesome. A little bit slow but I guarantee you will not loose interest even a bit.
10,14 out of 31 found this helpful,"Well written, Wonderfully directed and Amazing Performances.",sidlifeline,16 May 2020,This one proves that the series which leave hundreds of questions in viewers' minds throughout as well as at end are not the only ones that are good. A must watch crime thriller series.
9,14 out of 31 found this helpful,Compelling storyline and equally good direction!!,amandcet,16 May 2020,"Story is the king!!
All the characters have been brought to life by respective individuals. It is a must watch for dark cinema lovers."
9,14 out of 31 found this helpful,Watch for an excellent storyline and some amazing performances,vickymalhotraindia,16 May 2020,Jaideep Ahlawat hit this one out of the park. One of his best work
8,14 out of 31 found this helpful,Highly Recommended: Prime getting it right with the Indian content,alphadude007,16 May 2020,"There was Netflix's sacred games, which can be summed up in one word - EPIC. But, it seems like Netflix has lost the plot, at least with Indian content since. This is where Amazon prime came in with Family Man, Mirzapur, Breathe, and now Paatal Lok. No hyped up commercial actors, just a great story and actors who put their heart and soul into the series. The series was very well set-up, paced, acted, and wrapped up. No irrationalities or jarring logical issues or character inconsistencies during the first viewing. Essential watching. Very very good!"
10,14 out of 31 found this helpful,A show to watch definitely,imtiazu,16 May 2020,"This is writing at its best. From the first scene itself you can see the palpable sense of tension.
The powerful acting and the production design. The realistic set design and costume design adds Midas touch to the show.
Music is there just to insinuate the emotions sowed by the writers deep down into the characters.
This show is character play at its best.
Never ever expected such a well written show to come from India.Nothing feels more great than an well written character...It is almost orgasmic to see a flawed, realistic and raw representation of a carefully crafted character...Hathiram Choudhary is probably The One...P.S. - And hard hitting for a reason. It hits you hard."
9,14 out of 31 found this helpful,One of the best web series in india.,dheerajchoudhary-79095,16 May 2020,One of the best web series in india.it will keep you in suspense till the last episode.brilliant acting done by all the actors.it also shows the truth of our society about the caste system.
10,14 out of 31 found this helpful,Terrific and hence binge worthy web series..,sfilmi,16 May 2020,"This series is nothing but a cinematic brilliance of hard-hitting issues with near perfect acting of whole starcast..One of the best web show after Sacred Games, Mirzapur and Asur.. Totally binge worthy."
9,14 out of 31 found this helpful,A top class Afrighting Political Crime Thriller.,pritambag,16 May 2020,"Absolutely speechless after seeing such a horrifying political Crime Thriller. The series which starts with the segregation of Heaven, Earth and Hell in the world itself between different classes of people. But with time everything mixes up. The series highlights how each and every official has the tendency to take their piece of pie in between conflicts. The series sheds light on the naked society and how the society sets up the crime, the criminal only commits it, is the main premise of the story. The performances were brilliant including Jaideep Ahlawaat, Neeraj Kabi, Swastika Mukherjee, M.R.Singh and many more but the showsteller was Abhishek Banerjee as Hathoda Tyagi. The storyline, execution was of top notch. If you wanna watch a top class political crime thriller then this is the one. Go for it."
9,14 out of 31 found this helpful,Matched the Hype 🔥🔥,riddicksilent-28175,16 May 2020,"Just watch it , really brilliant dark series .Will leave you haunted showing the real face of our Indian society ,Brilliant cast no words to explain the performance.Watch it you will never regret it."
10,14 out of 31 found this helpful,A MASTERPIECE FROM INDIA,mohdkashifkhan-11503,16 May 2020,I can safely say that this is the best series ever created in the history if indian television. You just can't miss this one
10,14 out of 31 found this helpful,It will blow your mind,rohitsovale,16 May 2020,"What a drama...jaydev is marvellous. Tum kuch jyada hi bade wale chutiye nikle...😂.
Dialogues are crisp. It made me cry at many instances.truly spectacular series.
This series also tries to showcase the actual insides of our current Indian media."
