Rating,Helpfullness,Review Title,Reviewer Name,Review Date,Review Text
9,3 out of 8 found this helpful,Underrated & misunderstood,varunnk13,19 May 2020,"People are taking it as Crime/Thriller. It's actually mostly drama, rather Noirish (dark & cruel) or say, the reality of things which go on behind the scenes, it ranges beautifully between everything which is connected to the main role Inspector Hathiram. Family problems, career issues and his personal problems too, and good things, he grows as a character. It could have been a lil better if they hadn't tried too much to make it about characters and more about the story but it's a good show. 9/10"
3,3 out of 8 found this helpful,"Good performance, pathetic storyline, propaganda",syleshgopan,18 May 2020,"Good things first - the actors have delivered strong performance through out. Whether it is Jaideep Alhawat, Neeraj Kabi or Ishwak Singh. I noticed Jaideep's performance in Bard of blood, and can say this one is even better.Coming to the overall review, at least they had an interesting plot. When I say plot, i mean a one-liner like 4 criminals captured alive while trying to murder leading journalist of the country. But when they developed this into a full storyline, it became too weak, feeble and wasted. The whole pieces when put-together gives you a make-believe story and plot which fails big time.The makers have tried to slip-in and sell a propaganda. Some of the cliche scenes which you would have seen in some of the so called leftists film maker's product related to riots and communal tension. Cant believe we are seeing these one sided advertisement even on these new gen platforms.Overall, regret wasting my time !!!"
5,3 out of 8 found this helpful,Nothing interesting,brightconscious,17 May 2020,"Complete lack of humor , story drags a lot, characters are not developed,Good performance"
1,5 out of 17 found this helpful,Propaganda,mishra-avinash35,19 May 2020,This series is prime example of Hindu-phobia in India.This kind of series must be censored.
6,5 out of 17 found this helpful,Overrated. Only drama no action no trill,vks-79025,15 May 2020,This show is basically police crime drama with twisted plots. Many stories club and make a show. You may skip it.
9,7 out of 27 found this helpful,Good but not the best,JPEI64,15 May 2020,"Slow premise I thought it will pick up by episode 3. It kind of did, however not upto expectations. The series drags in parts and there's flashes of brilliance, and you kind of wait to see where this is all headed - nowhere outstanding.Point to note - excessive violence, cussing, nudity etc does not an impactful series make. Be original and you can do a lot more with less of the above. It felt that most of the language and violence were mostly for shock effect. Also there were many scenes especially when the characters attempt to convey emotions in English that appear stilted, artificial and awkward.Casting wise, Jaideep is brilliant. The others are equally brilliant. However, Gul Panag could never act, and she still can't. A few of the child artistes showed much more promise.At the most pretty average stuff - you would have seen many of the scenes, heard similar dialogues, camera angles etc. In average Western series.Underworld series are now kind of overdone. Anybody with original scripts out there?"
1,4 out of 13 found this helpful,Full propaganda,dr-prasannashetty,26 May 2020,Good story turned into propaganda. Full of hinduphobia just like many of the web series these days. Writers are scared to show the reality and just show Hindus as villains and terrorists for the convenience .
1,4 out of 13 found this helpful,BORING!!,vasishthaabhijeet,25 May 2020,"Don't have any political views about this, but this series is pretty boring, so trust me don't waste ur time, watch something good( watch any other good series again😂)."
4,4 out of 13 found this helpful,Waste of time.,kavishfacebook,17 May 2020,"Its a boring series. Various other and a lot better series are available (Money heist, the last dance, etc. ). It's highly over rated."
1,5 out of 18 found this helpful,Hindu bashing at its nauseating best,discerninguser,19 May 2020,Too much of anti Hindu rhetoric here. Every episode reeks of it. Show tries hard to portray Hindus as intolerant and evil. While Muslims and leftists are shown as too good to be true.
1,5 out of 18 found this helpful,Movie full of Propaganda,shubhankarrajput-00112,19 May 2020,"Movie is full of Propaganda which is anti right wingers , and pro hard core Left, but the acting done by deepak Ahlawat is awesome ."
9,3 out of 9 found this helpful,Must Watch,junedahmed-05364,24 May 2020,"This Web-Series is for everyone who loves realistic cinema. Great Acting, Great Story, Great Screenplay and Great Editing.Shows the truth of Today's India but little spiced up.Ignore everyone who call this ""Hinduphobic"".
This really isn't."
6,3 out of 9 found this helpful,HOLES IN THE SCRIPT,sunildaswaney-63642,21 May 2020,"Lots of details were ignored in PAATAL LOK which resulted in lots of holes in the plot.For example why did it take so long to look for the yellow phone when this should have been done almost immediately?When found were the contents analysed and discussed at a higher level?
How were dangerous criminals arrested without any handcuffs put on them?Hathi Ram lost his main notebook and he never noticed it missing, until it was shown to him by a journalist who had taken it.
He notices the chaiwala glaring at Cheeni and she at him and does not take any action on that.
These are just a few examples.
The makers should have paid much keener attention to the details and not allow an excellent script to have so many holes.The acting by almost everyone was competent with the standouts being Hathi Ram and Tyagi.Gul Panang was totally wasted in the home as her role had no substance whatsoever.
All in all with more dedication and focus this show could have been even better than it ended up being."
10,3 out of 9 found this helpful,Best Ever.,ggrdhiman,20 May 2020,The series is not only engaging but says alot within the lines. Must watch.
8,3 out of 9 found this helpful,A Riveting Crime-Thriller,c-ravishankar1990,20 May 2020,"What I liked about this show:
1. Screenplay and structuring
2. Cinematography
3. Performances
4. Chase SequencesWhat I didn't like about the show:
1. Poor conclusion
2. Few characters that are part of the show just to fill spaces.In a nutshell, even though the show has a few flaws, it manages to keep the viewer hooked and at the edge of the seat, like a thriller should!"
10,3 out of 9 found this helpful,All time classsic,anayrocking,20 May 2020,This is easily one of the best webshows or any entertainment content to come out of india which is full of romantic movies or movies that potray situations that will never happen. This shows reveals truth about culture and society and is nothing sort of reality combined with fiction. It has done a beautiful act of combining various genres and characters from totally different genres into one and has indeed done it successfully. In simple words this is a must watch.
10,3 out of 9 found this helpful,Amazing webseries,cubanmark,20 May 2020,"One of the best web series in India
Surely will be remembered as a classic. It is has a very relevant storyline with real characters unlike typical Indian movies starring police officers. Please give it a watch because it is a must watch"
4,3 out of 9 found this helpful,ONLY CLIMAX I LIKED,malleshpoojari,18 May 2020,"SOME SCENE WAS LIKE I SEEN BEFOFE BUT I ONLY LIKE JAIDEEP, SERIES WAS VERY BORING FULLY STRETCHED IF YOU LOOKING WO INDIAN MYTHOLOGY CRIME THRILLE SERIES WATCH ASUR
I HATE THE MOST OF PAATAL LOK IS HYPE, TOO HYPE GIVE FOR THIS SERIES BECOUSE IS ANUSHKA SHARMA BANNER"
10,3 out of 9 found this helpful,Loved the show.,deepanshuchg-53252,17 May 2020,"Watched the show without any expectations but really liked it. Great acting. Great story. I don't see any propaganda being pushed like the right wing is talking about in the reviews. Most of the things shown are very realistic, maybe that's what triggering them."
10,3 out of 9 found this helpful,Excecptional!,gauravbhatia-98187,17 May 2020,"Awesome acting. Excellent storyline. Grippping series.Better than Sacred Games, Family Man and Mirzapur for me!"
6,3 out of 9 found this helpful,Not well directed .,faizkhan658,16 May 2020,"Story is quite good but not the direction. Wrong casting lesser details spoon feeding scenes. But you can watch this show for jaideep ahlawat, vipin sharma, chaku & supporting actors."
2,2 out of 5 found this helpful,A few actors gave their best.,anupams33,25 May 2020,"Apart from a few excellent actors, the plot is just lame and puts you to sleep. Director seems like an amateur with no vision. The series leads in one direction and then loses the plot in between.One can skip it if they really want to watch quality shows."
10,2 out of 5 found this helpful,Finest piece of television.,waasayhkhan,22 May 2020,"This is probably the finest tv show coming out of India. The story line, buildup and the characters are phenomenal. Acting by all the actors is jaw dropping. This is a must watch show, it's worth your time."
10,2 out of 5 found this helpful,Scintillating🙌,irshadnova,22 May 2020,"Brilliant performances
Haunting realities
Execellant writingI can see bhakts and right wing stooges are running a campaign to degrade the IMDB rating of this show, but never mind, because we know that's its not that this series event inflict hatred against any particular community but instead it's show there fear, there fear of the truth"
10,2 out of 5 found this helpful,Awesome,anxwtsp,22 May 2020,This story shows actually what happen to these days in India.
9,2 out of 5 found this helpful,Real stick climax.,nanuralamna-60106,19 May 2020,Great work.what a acting by Jaydeep and others.The climax was original. There would be many obstacles in real life to solve such politics matter. If it was solved then it would be cinematic.waiting for S2.only for jaydeep and director .Best if kecil.
8,2 out of 5 found this helpful,Good one but over hyped,rahulsam-15397,18 May 2020,Good one but over hyped. The much talked about twist was low key and hence ended up as a good series instead of a great one
9,2 out of 5 found this helpful,Dark Side of Hindus,baba-maal,18 May 2020,"This show has dared to unveil the darker morally corrupted side of Hindu society which is offending many So called Hindu saviours.
Deep down we Hindus knows our corrupted soul but we have been hiding it under blanket for ages and nevr admit in open.
This TV show has dared to show Hindus a mirror, when majority saw thia show they basically saw their ugliest face.Kudos to director who perfectly depict current ongoing black situation of this society.Acting of Jaidip is ton notch, even small character have put best show.
My key takeaways from this show.
CBI is basically diapar cleaner of Government.
Journalism is all about TRP.
Ground level journalist are really working hard.
UP is still No-1 criminal state, NO doubts.This show is by far best among Sacred Games and Mirzapur.Tyagi, a silent killer is best.
Ambience music is complimentary to suspense scene."
8,2 out of 5 found this helpful,A new and brilliant take on crime drama genre,someshkumar-47856,18 May 2020,"I see many people calling it a propaganda by leftist and liberals. Maybe it is or maybe its not, but what matters the most in a series is the storyline and acting. People watch shows for the story and acting of the cast, which in this case is superb. See if the story was just presented as a propoganda then it would have been bad but there is a solid and believable plot supporting how things turn out. So, at last I just want to say that don't get the wrong idea about the show from the negative reviews but just watch it yourself and decide whether it's good or not.
And as for me, it was not a bad one for sure."
9,2 out of 5 found this helpful,Just Awesome!,naughtyboynavneel,18 May 2020,"Must Watch Crime thriller!
Should be watch by everyone who loves crime scenes, But Mirzapur and Sacred Games had its own Fanbase, Paatal lok soon will make one of its kind
Watch and Have Fun"
9,2 out of 5 found this helpful,Paatal Lok- Indian Series for 2020,porwal_1989,17 May 2020,"The series when released it trailer did keep the story under wraps. However when you start to watch it, you are hooked on it. The series has well defined raw edgy content. Every actor has played a superb role that was given to him. Each of them shined throughout the part they played. Main lead -Hathi ram and Tyagi were marvellous. Abhishek as Tyagi is one fine actor. Even with minimal lines. The expression he gave perfect. He could speak so much without saying anything.
Pros: Story,Acting,Cinematography.
Cons: To much to digest, Religious fundementalism,However the show cant be missed. Its a must watch."
8,2 out of 5 found this helpful,Genuine Content,tapas-76683,16 May 2020,"Intense - Dark - Gruesome - Thriller - CrimeDrama - Dirty Politics - Police - Media - System - Elections - Erotic - Mythology - Social.... Every possible Genre Of Filmography Have been packed in this show. Top-Hole Content with a great Concept. 😌🙌Strong Script , Well fabricated Screenplay with esteemed level of Acting. Superlative performance from All Actors. Especially Jaideep Ahlawat , Neeraj Kabi & Abhijit Banerjee. It's Slow paced drama but Yes if You are looking for Good Content It's Quite Binge for you. 4.5/5🌟"
4,4 out of 14 found this helpful,Another Political Play,harshabale,19 May 2020,The plot and the story just resembled teh older Sacred Games and the Family Man. This is no differ than those. Prime should really change and go for a bigger content here.
1,4 out of 15 found this helpful,Entertain but don't be play on emotions,priyanktalati,18 May 2020,Leftist agenda alert. Don't criminalize the majority to spread the Marxist ideologies.
1,4 out of 15 found this helpful,Hinduphobic,pawansah-98790,18 May 2020,"Full of propaganda and hinduphobic webseries
Don't watch it"
4,4 out of 15 found this helpful,Why so much characters buildup when there is nothing further to do with them,animatorsurajpal,16 May 2020,"They have done some great job for characters buildup but this leads to nowhere but to a average end, instead of focusing on realism (nudity) they could make a thrilling end which includes Tyagi."
5,3 out of 10 found this helpful,Entertaining but Confusing and chaotic script,qui_j,22 May 2020,"This is an interesting series, one in a genre of new Indian offerings that are non-Bollywood. It certainly goes beyond the limits of current censorship and deals with topics like corruption and social ills. The series is interesting but the script tells the story in an unnecessarily complicated, incomprehensible and chaotic manner. If there is a series 2, hopefully that failing will be corrected!"
10,3 out of 10 found this helpful,Jaideep Ahlawat is a gem,rs-24335,20 May 2020,Hothoda Tyagi and Hathiram at their best. Well written. Well executed.
10,3 out of 10 found this helpful,One of the best,drswatichauhan,20 May 2020,Gripping story line...wonder full performance..must watch
1,4 out of 16 found this helpful,Poor Poor,swarnimd,24 May 2020,"Poor Boring Discriminatory Waste of Time
Poor story poor acting Avreage Direction."
10,3 out of 11 found this helpful,Best Indian Web Series,hardikmitawa-40870,21 May 2020,Seemless Storytelling with politics of characters showed smoothly and depicting both worlds and sides
1,2 out of 6 found this helpful,Very lengthy series,surajkhule-23729,25 May 2020,Tried for getting interest.. but worst series ever
1,2 out of 6 found this helpful,Worst series,aditya1122,24 May 2020,This series is worst. And the the of such time should be avoided
10,2 out of 6 found this helpful,One of the best crime drama series from India,varunmadhu,24 May 2020,"I binge watched it yesterday, its a story which throws light on many socio- political issue in our country. I have seen lot of negative comments and most of the people pointing out the anti hindu agenda or left liberal political movement. Our country is progressing well but in some part of our country especially rural areas of north india still caste based system exists and many recent newspaper reports are evidence for this. Direction is top notch and story is also interesting but editing could have been better. Supported by a stellar cast and everyone will be a fan of Jaideep Ahlawat once you finish the show. Just watch the series of you are a true movie fan who loves content."
10,2 out of 6 found this helpful,👌👌,mainak-54209,23 May 2020,"Great,indeed❤❤❤❤❤❤❤❤❤❤❤❤❤❤❤❤❤❤❤❤❤❤❤❤❤❤❤❤❤❤❤❤❤❤❤❤❤❤❤❤❤❤❤❤❤❤❤❤❤❤❤❤❤❤❤"
10,2 out of 6 found this helpful,Just awesome,lkjha,23 May 2020,"Really superb acting
Interesting plot
Nothing high five...adhere to actual ground of reality
Don't expect Christopher Nolan twist..but you will you will be thrilled to beyond"
10,2 out of 6 found this helpful,Best web series seen so far,sirohiabhinav,22 May 2020,"Acting, casting, story, suspense etc etc each and everything is simply superbe. Jaideep ahlawat gave an oscar winning performance.PS- Its better than Sacred Games ;)"
8,2 out of 6 found this helpful,Ignore the fascists and phobia comments: MUST WATCH,alphadude007,22 May 2020,"I identify myself as a centrist and I am appalled at the negative publicity this series is receiving. I did not find any propoganda being propogated in this series. In fact, the minor (a few scenes) in this series where differences between Hindus and Muslims are depicted have been done with such class and realism compared to a majority of others. This is an awesome series which is a must watch. The director and the actors have put their heart and soul into this and I am so disappointed that this series is not getting the credit it deserves. So, please ignore the radicals and give this series a watch. Gripping, thrilling, and engaging."
10,2 out of 6 found this helpful,Great Series,hardyrockx,21 May 2020,"I enjoyed watching it, found it more realistic than ""Sacred Games"". Thumbs up to the creators, good content should be appreciated!"
10,2 out of 6 found this helpful,Top of the line absolutely amazing,choudharysubroto,20 May 2020,Season 2 is definitely a must now. Season 1 has been truly amazing. Phenomenal work done by every single actor. Nobody would have expected Jaideep to come this far. Thank you Amazon India to bringing this to us.
5,2 out of 6 found this helpful,Neither too bad nor too good,chauhanrishuchauhanrishabh,19 May 2020,"I don't know why most of the reviews are complaining about the anti hindu propanganda and giving it a 1 star. Watching this web series or any web series, keeping your party propanganda an idolism in mind would be wrong.
This series shows the harsh realities of the society, not just Hindus. It shows the communal tensions and violence and also shows the caste violence.
The main protagonist is an awesome actor but in my opinion the screenplay of this series is weak. It doesn't explore it's antagonist or some other cast members storyline much.
I think they were not able to put everything together in the way they should have.
The climax was also not good.
You will keep on waiting and waiting for some surprise in the series but you will be kept waiting.
It's an average series."
6,2 out of 6 found this helpful,Over-Hyped...,prem-23773,18 May 2020,I was very excited in the beginning...as i heard lots of positive reviews about the movie....but as i started...i feel..its very boring in the middle parts....so...its good.but not satisfied with the storytelling.sorry.but as we know because of lockdown....its very obvious that we all will watch thos once...and will feel the same..as i felt.
7,1 out of 2 found this helpful,Gritty and brutal,delsoca,26 May 2020,"The story and acting was very gritty. It kept me guessing all the way till the last episode. The main actor was brilliant.To be honest there was not a weak actor in the series.The main police officer was not the standard leading man, he was flawed, made errors of judgement, etc, but that added to the realism and made you engage with him as a character.The story has a darkness, which does not hold back with the gore and violence. It touches on wealth, religion, caste, the big city and the regions of India. If there was a second season it would be definitely on my list.
I would note that I do not speak Hindi and watches this show using the subtitles."
8,1 out of 2 found this helpful,It's a good watch... Worth your time...,xritesh,25 May 2020,"Pataal lok is all about power and politics which is very common in India. Acting, story, background score, dialogues, picturisation all is good. If you liked sacred games, gang of vassaypur your will love this."
7,1 out of 2 found this helpful,"Fake News, Child abuse, LGBT, casteism, politics and good acting",compazhar,25 May 2020,"Its very rare that u find such an intricate stories shown on the screen with such brilliance. evry story has been given the right time and amnt on screen which makes the viewing experience always on the edge. And with that top story line u have good performance by jaideep, abhisheek and Neeraj."
9,1 out of 2 found this helpful,"Dive into a the good, bad and ugly!",kumarvidushi,25 May 2020,"Paatal Lok is one of those series which makes you feel good about its end. You have complete arcs of the characters, some great performances and very realistic storytelling. This series stands out for its dark narration and insane visuals."
9,1 out of 2 found this helpful,Fabulous Content Well Executed.,kaybee-03956,25 May 2020,"Classic showcasing of the reality India and the world at large is still facing. It highlights the weak situation of the poor/ lower class are still into. Tough actions they are forced to take which are definitely incorrect but morality is not a choice. The real issues of sexual abuse, robbery, casteism, hatefulness, violence and deadly revenge, the divide between the rich and poor.Though true, I hated it when DCP Bhagat in the last episode says System will never change, only the people who do not perform their roles assigned will get replaced. It's a shame of what a society we have created after so many years of evolutionary process gone into. Power and the lust for Power in the hands of few making them do stuff taking the society into ""Paatal Lok"". Even the highly reputed organisation like Police Force, CBI or it could have been any other institute dance to their tunes. In any given society if we can eradicate the creation of Paatal Lok then only we as a group of people will come up as winners.Finally I would say that good karma/ deeds always brings good results as we saw in case of love and care of the stray dogs saved life.Kudos to the team and congratulations on their success! Direction and casting was spot on. I hope there are much more audience to this as at least we have moved positively in content creation."
9,1 out of 2 found this helpful,Brilliantly written and executed. Jaideep Ahlawat was tailor made for this.,suhalkapranay,25 May 2020,"Very difficult to make a crime thriller with such perfection and realism. The story arc takes a complete circle and executed brilliantly. There were instances which made me in awe of the sheer audacity of the writers yet unheard of in India's entertainment space.
The characters are well written with realistic and intriguing background. You get an understanding of where these characters come from which is brand new perspective on them.
One thing that stands out in this series is the way that sensitive issues like child trafficking, caste dynamics in rural India takes place which most writers don't address as they deem it too controversial or don't find it worth their time. The series deals with a lot of social injustice and practices prevailing in the lower sections of society which is largely unheard of among the privileged ones and hence is rightly called 'paatal lok.
As for people deeming it Anti-hindu, I, personally did not find it to be that. In fact it gives a few references of Mahabharat and how they still hold true in today's time which tells us how timeless these great legends are.
Talking about performances Jaideep Ahlawat stands out in the series with his brilliant portrayal of an underachieving cop tired of taking orders from people who worked under him once and is now desperate to prove himself.
Neeraj Kabi, in my view, was an opportunity wasted. He is a decent actor and could have done more with the role. All other actors justify the roles and execute them satisfactorily.
All in all its a whole new type of crime thriller in the underbellies of modern India."
10,1 out of 2 found this helpful,Mind-blowing series,nidhibhardwaj-28739,25 May 2020,"Very engaging series. nailbiting. However, after watching so many thriller stories. I was pretty sure from the starting who the real antagonist was. But i loved watching it. The main character is very talented. Some scenes surely gives goosebumps. watched it for entertainment."
